{
  "$schema": "../schema/aspx-acquisition-consumer-profile.schema.json",
  "dispatches": [
    {
      "aggregateOutput": "aspx-acquisition-verdict/v1",
      "name": "assessment-v1",
      "paginationReceipt": null,
      "physicalContract": "aspx-discovery/v2",
      "physicalOutput": "aspx-discovery-output/v2",
      "physicalStore": "aspx-discovery-sqlite/v2",
      "productRef": "pnp/assessment@3012555317d5a8ee981b9e103206f3f0680333d8",
      "provider": "sharepoint-live-aspx-provider/v1",
      "referenceContract": "aspx-reference/v1",
      "referenceOutput": "aspx-reference-output/v1",
      "referenceStore": "aspx-reference-sqlite/v1",
      "surfaceContract": "aspx-surface-applicability-denominator/v3",
      "terminalReceipt": null
    },
    {
      "aggregateOutput": "aspx-acquisition-verdict/v2",
      "name": "assessment-v2",
      "paginationReceipt": "aspx-pagination-page-receipt/v2",
      "physicalContract": "aspx-discovery/v2",
      "physicalOutput": "aspx-discovery-output/v2",
      "physicalStore": "aspx-discovery-sqlite/v2",
      "productRef": "pnp/assessment@ccc655b68fc6be9cdf107e6d8fe7d9f56266182a",
      "provider": "sharepoint-live-aspx-provider/v2",
      "referenceContract": "aspx-reference/v2",
      "referenceOutput": "aspx-reference-output/v2",
      "referenceStore": "aspx-reference-sqlite/v2",
      "surfaceContract": "aspx-surface-applicability-denominator/v4",
      "terminalReceipt": "aspx-acquisition-terminal-receipt/v1"
    }
  ],
  "platformBuild": "16.0.27709.12001",
  "profileHash": "de30575284989ded91ff5ea4eb9bf57010fa89968b02c762cacb45d6e435a58d",
  "profileRevision": "spo-online-16.0.27709.12001-acquisition-consumer-r1",
  "profileSchemaVersion": "aspx-acquisition-consumer-profile/v1",
  "registryHash": "3138b6d0b1e1af1e170801939d2c1e00793e61cb17f53c6f7d01e61cf3507830",
  "registryRevision": "spo-online-16.0.27709.12001-r1",
  "terminalRoleVersions": {
    "aggregate-output": "aspx-acquisition-verdict/v2",
    "physical-database": "aspx-discovery-sqlite/v2",
    "physical-output": "aspx-discovery-output/v2",
    "reference-database": "aspx-reference-sqlite/v2",
    "reference-output": "aspx-reference-output/v2"
  }
}
